{
  "id": "occupancy_v1",
  "name": "Room Occupancy Estimation",
  "status": "positive",
  "version": "1.0.0",
  "description": "Estimates room occupancy class (0 / 1 / 2 / 3+ people) from low-intrusion signals: WiFi RSSI perturbation, battery thermal drift, and micro-vibration via accelerometer. No microphone, no camera.",
  "task": "room occupancy: 0 / 1 / 2 / 3+",
  "signals": [
    { "family": "network", "name": "wifi_rssi", "sampling": "every 5 s", "android_permission": "ACCESS_FINE_LOCATION" },
    { "family": "battery", "name": "battery_temperature", "sampling": "1 Hz", "android_permission": "none" },
    { "family": "thermal", "name": "skin_temperature", "sampling": "1 Hz", "android_permission": "none" },
    { "family": "imu", "name": "linear_acceleration", "sampling": "100 Hz", "android_permission": "none" }
  ],
  "model": {
    "kind": "gradient-boosted trees over 10 s windowed features",
    "features": "RSSI variance + spectral entropy, thermal slope, accel band energy 0.5-4 Hz",
    "artifact_hash": "sha256:3f9a1c2e"
  },
  "confidence": 0.92,
  "accuracy": 0.91,
  "metrics": {
    "precision": 0.9,
    "recall": 0.89,
    "f1": 0.9,
    "roc_auc": 0.95,
    "cross_device_accuracy_drop": 0.04
  },
  "energy_mj": 12,
  "latency_ms": 18,
  "privacy_audit": {
    "score": 0.7,
    "bystander_inference": "Reveals presence and coarse count of non-consenting room occupants; does not identify individuals at the recommended operating point.",
    "escalation_gradient": "Higher IMU rates plus per-AP RSSI could support coarse localization of occupants within the room; identification not demonstrated.",
    "permissionless": false,
    "mitigations": "Cap IMU at 100 Hz and quantize RSSI to 2 dBm; occupancy accuracy retained, localization escalation degrades below baseline.",
    "disclosure_sensitive": false
  },
  "generalization": {
    "train_oems": ["Google", "Samsung"],
    "test_oems": ["Xiaomi"],
    "train_rooms": ["office-2F-east", "bedroom-A"],
    "test_rooms": ["conference-1F"],
    "per_oem_accuracy": { "Google": 0.93, "Samsung": 0.91, "Xiaomi": 0.89 }
  },
  "supported_devices": ["Pixel 8", "Galaxy S24", "Redmi Note 13"],
  "unsupported_devices": [],
  "training_protocol": "EXP-001",
  "validation_protocol": "EXP-001 cross-OEM/cross-room split (docs/architecture.md section 5)",
  "reproducibility": { "independent_runs": 2, "within_ci": true },
  "provenance": [
    "sha256:a1b2c3d4e5f60718",
    "sha256:0918273645fedcba"
  ],
  "limitations": [
    "Requires the phone to be stationary on a surface in the room.",
    "Accuracy degrades when HVAC state changes mid-window."
  ],
  "failure_modes": [
    "Aggressive WiFi scan throttling on some OEM power-saver modes starves the RSSI feature."
  ],
  "references": ["EXP-001 report (results/EXP-001/)"],
  "valid_until": "2027-01-19",
  "half_life_days": 180,
  "date_created": "2026-07-19",
  "last_verified": "2026-07-19"
}
